[
  {"id": "frodo_sold_bag_end", "text": "Mr. Frodo has sold Bag End to the Sackville-Bagginses, so they say, and for hardly any price at all.", "origin_poi": "green_dragon", "start": "3018-09-21T10:00", "strength": 4, "max_hops": 6, "hours_per_hop": 6, "verify": true},
  {"id": "strange_folk_on_east_road", "text": "Strange folk are passing along the East Road these days: tall, grim and in a hurry, and none will say whence they come.", "origin_poi": "bree_west_gate", "start": "3018-09-20T08:00", "strength": 2, "max_hops": 5, "hours_per_hop": 8, "verify": true},
  {"id": "dwarves_going_east", "text": "Companies of Dwarves have been seen on the Road, tramping along with heavy packs and not stopping to talk.", "origin_poi": "bree_west_gate", "start": "3018-09-20T08:00", "strength": 2, "max_hops": 5, "hours_per_hop": 8, "verify": true},
  {"id": "black_rider_in_hobbiton", "text": "A black-cloaked rider came to Bagshot Row asking the Gaffer after one Baggins, and sniffing like a hound.", "origin_poi": "bagshot_row", "start": "3018-09-23T19:00", "strength": 3, "max_hops": 5, "hours_per_hop": 3, "verify": true},
  {"id": "frodo_left_bag_end", "text": "Mr. Frodo has gone off at night with young Sam Gamgee and Master Peregrin, and no one knows where.", "origin_poi": "bywater", "start": "3018-09-24T08:00", "strength": 3, "max_hops": 5, "hours_per_hop": 5, "verify": true},
  {"id": "elves_in_woody_end", "text": "Elves were heard singing in the Woody End last night, a fair company going west.", "origin_poi": "gildor_camp", "start": "3018-09-24T22:00", "strength": 3, "max_hops": 4, "hours_per_hop": 6, "verify": true},
  {"id": "maggot_dogs_and_rider", "text": "A Black Rider rode up to Farmer Maggot's gate, and Maggot's dogs wouldn't stop barking for an hour.", "origin_poi": "maggots_farm", "start": "3018-09-25T10:00", "strength": 3, "max_hops": 4, "hours_per_hop": 5, "verify": true},
  {"id": "gandalf_seen_in_hobbiton", "text": "The old Wizard Gandalf was seen riding a great white horse through Hobbiton, but he would not tarry.", "origin_poi": "bagshot_row", "start": "3018-09-29T09:00", "strength": 3, "max_hops": 4, "hours_per_hop": 5, "verify": true},
  {"id": "black_riders_asking_for_baggins", "text": "Black riders on black horses have come to the West-gate of Bree asking for a Baggins.", "origin_poi": "bree_west_gate", "start": "3018-09-29T20:00", "strength": 4, "max_hops": 5, "hours_per_hop": 4, "verify": true},
  {"id": "hobbit_vanished_at_pony", "text": "A hobbit calling himself Underhill vanished clean out of the Pony's common room, so they say, right in the middle of a song.", "origin_poi": "prancing_pony", "start": "3018-09-29T22:30", "strength": 5, "max_hops": 4, "hours_per_hop": 3, "verify": true},
  {"id": "black_riders_raid_pony", "text": "Something broke into the Prancing Pony in the night and slashed the beds, and left a dreadful cold behind it.", "origin_poi": "prancing_pony", "start": "3018-09-30T02:00", "strength": 5, "max_hops": 6, "hours_per_hop": 3, "verify": true},
  {"id": "horn_of_buckland", "text": "The Horn of Buckland was blown in the night! Black riders came to Crickhollow and Fatty Bolger fled them.", "origin_poi": "crickhollow", "start": "3018-09-30T02:30", "strength": 5, "max_hops": 6, "hours_per_hop": 2, "verify": true},
  {"id": "hobbits_left_with_strider", "text": "Four hobbits left Bree this morning in the company of that Ranger, Strider, and a poor old pony from Bill Ferny.", "origin_poi": "prancing_pony", "start": "3018-09-30T09:30", "strength": 3, "max_hops": 5, "hours_per_hop": 4, "verify": true},
  {"id": "lobelia_moved_into_bag_end", "text": "Lobelia Sackville-Baggins has moved into Bag End at last and is counting the spoons.", "origin_poi": "bag_end", "start": "3018-10-02T11:00", "strength": 4, "max_hops": 5, "hours_per_hop": 5, "verify": true},
  {"id": "weathertop_attack", "text": "They say fire was seen on Weathertop by night, and a cold cry that carried for leagues.", "origin_poi": "east_map_edge", "start": "3018-10-06T23:00", "strength": 1, "max_hops": 2, "hours_per_hop": 12, "verify": true},
  {"id": "player_found_senseless", "text": "{player} was found senseless on the road, cold as a stone and talking of black riders.", "origin_poi": "bywater", "start": "3018-09-22T08:00", "strength": 3, "max_hops": 4, "hours_per_hop": 6}
]
